{
  "id": "report_customer_accounts",
  "acl": "Magento_Reports::customers_accounts",
  "dataSource": {
    "provider": "grid.collection",
    "config": {
      "collection": "report_customer_accounts.collection"
    }
  },
  "settings": {
    "pageSize": 100,
    "pageSizes": [50, 100, 200],
    "massActions": false
  },
  "columns": {
    "accounts": {
      "label": "New Accounts",
      "type": "text",
      "sortable": false,
      "position": 10
    }
  }
}
