{
  "id": "report_customer_totals",
  "acl": "Magento_Reports::customers_totals",
  "dataSource": {
    "provider": "grid.collection",
    "config": {
      "collection": "report_customer_totals.collection"
    }
  },
  "settings": {
    "pageSize": 100,
    "pageSizes": [50, 100, 200],
    "defaultSort": {
      "field": "orders_sum_amount",
      "direction": "desc"
    },
    "massActions": false
  },
  "columns": {
    "name": {
      "label": "Customer",
      "type": "text",
      "sortable": false,
      "position": 10
    },
    "orders_count": {
      "label": "Orders",
      "type": "text",
      "sortable": false,
      "position": 20
    },
    "orders_avg_amount": {
      "label": "Average",
      "type": "price",
      "sortable": false,
      "position": 30
    },
    "orders_sum_amount": {
      "label": "Total",
      "type": "price",
      "sortable": false,
      "position": 40
    }
  }
}
